{
  "classification": "real_incident",
  "summary": "GET /api/orders/express-1002 returns 500 because order_detail computes the express delivery estimate with placed_at.replace(day=placed_at.day + 2), which raises ValueError near month end. Fixed with timedelta(days=2) and a regression test.",
  "user_impact": "Every request for express orders placed on the 27th or later of a month (seeded order express-1002, created on the last day of the previous month) returns HTTP 500. Standard orders are unaffected.",
  "root_cause": "app/main.py:81 in order_detail builds the estimate with placed_at.replace(day=placed_at.day + 2). When day+2 exceeds the number of days in the month, datetime raises \"ValueError: day is out of range for month\". The seed order express-1002 is dated the last day of the previous month, so it always triggers this. The bug depends on the date, not on a recent deploy: both versions 29b082a and 95b99c8 show the same error.",
  "evidence": [
    {
      "source": "logs",
      "reference": "Loki ERROR lines, e.g. trace_id=2b20289f1472765d1466d4ad42003e32",
      "observation": "15 ERROR lines on the route, all ValueError: day is out of range for month"
    },
    {
      "source": "code",
      "reference": "app/main.py:81 (stack trace) and order_detail",
      "observation": "placed_at.replace(day=placed_at.day + 2) overflows at month end"
    },
    {
      "source": "code",
      "reference": "app/main.py seed data (previous_month_end)",
      "observation": "express-1002 is seeded with created_at = last day of the previous month, so it always overflows"
    },
    {
      "source": "traces",
      "reference": "Tempo trace 220cc9ab9c479bfc0547d8048476458b",
      "observation": "span orders.build_detail errors with order.priority=express, order.id=express-1002"
    },
    {
      "source": "metrics",
      "reference": "five_xx_last_5m / cumulative_by_status",
      "observation": "Only 500s with error_type=ValueError; 15 total, on both service_versions 29b082a and 95b99c8, so not tied to one deploy"
    },
    {
      "source": "alert",
      "reference": "OrderTracker5xx",
      "observation": "Fired on route /api/orders/{order_id} with 3 5xx in 5m; not a test notification"
    }
  ],
  "confidence": 0.95,
  "proposed_action": "patch",
  "changes": [
    {
      "file": "app/main.py",
      "description": "order_detail: replace placed_at.replace(day=placed_at.day + 2) with placed_at + timedelta(days=2). timedelta was already imported."
    },
    {
      "file": "tests/test_api.py",
      "description": "Added test_express_estimate_crosses_month_end, parametrized on fixed dates (2026-08-31 to 2026-09-02, 2026-02-27 to 2026-03-01), independent of today's date."
    }
  ],
  "tests": {
    "ran": true,
    "command": "uv run --frozen pytest -q",
    "passed": true,
    "summary": "With the fix: 7 passed. With the fix temporarily reverted: 2 new tests failed and 5 passed, so the regression test fails before the fix and passes after."
  },
  "verification_requests": [
    "/api/orders/express-1002"
  ],
  "escalation_reason": null,
  "final_message": "INC-20260930-125833-d5da: 500s on /api/orders/{order_id}, from order_detail in app/main.py:81.\nCause: replace(day=day+2) raises ValueError near month end. It hits express orders placed on the 27th or later, such as seeded express-1002.\nFix: use placed_at + timedelta(days=2), plus a regression test. Full suite passes (7), and the new tests fail without the fix.\nReplay after deploy: GET /api/orders/express-1002.\nVerdict: real incident, date-dependent bug in delivery estimate, small patch proposed with confidence 0.95."
}