{
  "classification": "test_notification",
  "summary": "Alert is a responder test notification (label test=\"true\", alertname ResponderTest, summary \"Test notification; no incident to fix\"). No route, no 5xx, no error logs or traces. No incident to fix.",
  "user_impact": "None observed. The app is healthy and /healthz returns 200.",
  "root_cause": null,
  "evidence": [
    {
      "source": "alert",
      "reference": "labels.test / annotations.summary",
      "observation": "test=\"true\", alertname=ResponderTest, summary says 'Test notification; no incident to fix'."
    },
    {
      "source": "metrics",
      "reference": "five_xx_last_5m",
      "observation": "No series, so there are no 5xx responses."
    },
    {
      "source": "metrics",
      "reference": "cumulative_by_status",
      "observation": "Only one 404 on /api/orders/{order_id} (0 increase in the 15m window) and 6 healthz 200s. No 5xx."
    },
    {
      "source": "logs",
      "reference": "{service_name=\"order-tracker\"} | severity_text=\"ERROR\"",
      "observation": "0 error log lines."
    },
    {
      "source": "traces",
      "reference": "{resource.service.name=\"order-tracker\" && status=error}",
      "observation": "0 error traces."
    },
    {
      "source": "deploy",
      "reference": "evidence.json Deployment",
      "observation": "Container healthy, /healthz returns 200 {\"status\":\"ok\"}, HEAD 1d6ea59, deployed version 29b082a."
    }
  ],
  "confidence": 0.97,
  "proposed_action": "none",
  "changes": [],
  "tests": {
    "ran": false,
    "command": null,
    "passed": null,
    "summary": "Read-only run and no code change, so no tests were run."
  },
  "verification_requests": [],
  "escalation_reason": null,
  "final_message": "INC-20260930-125408-4a25: the alert is labelled test=\"true\" (ResponderTest).\nThere are no 5xx responses, error logs or error traces. /healthz returns 200 and the container is healthy.\nNothing was changed and there is nothing to fix.\nVerdict: test_notification, no action needed."
}