{
  "classification": "real_incident",
  "summary": "GET /api/orders/express-1002 returns 500 (ValueError: day is out of range for month). order_detail computed the express delivery estimate with placed_at.replace(day=placed_at.day + 2), which fails when the order was placed on the 29th-31st of a month. Fixed with a timedelta.",
  "user_impact": "Any express order placed on the last days of a month (e.g. seeded express-1002, placed on the previous month's end) cannot be fetched; every GET returns 500. Standard orders are unaffected.",
  "root_cause": "app/main.py order_detail: `placed_at.replace(day=placed_at.day + 2)` raises ValueError when day+2 exceeds the month length. It is a latent bug, triggered by the seed data (express-1002 has created_at set to the previous month's last day). It is not caused by a recent deploy.",
  "evidence": [
    {
      "source": "logs",
      "reference": "Loki error logs, trace 643fdae01abf5b033fad9ccb0df23417",
      "observation": "ValueError: day is out of range for month at app/main.py line 81 in order_detail"
    },
    {
      "source": "traces",
      "reference": "Tempo traces 643fdae0..., f6834d3d..., 114fe6ee...",
      "observation": "All failing spans carry order.id=express-1002 and order.priority=express; orders.build_detail span holds the exception"
    },
    {
      "source": "metrics",
      "reference": "cumulative_by_status",
      "observation": "All 7 500s are ValueError on this route, on both service versions 29b082a and 95b99c8, so it is not a deploy regression"
    },
    {
      "source": "code",
      "reference": "app/main.py:61-64,81",
      "observation": "Seed sets express-1002 created_at to the previous month's last day; .replace(day=day+2) overflows"
    }
  ],
  "confidence": 0.97,
  "proposed_action": "patch",
  "changes": [
    {
      "file": "app/main.py",
      "description": "order_detail: estimated_at = placed_at + timedelta(days=2) instead of replace(day=day+2)"
    },
    {
      "file": "tests/test_api.py",
      "description": "Add test_express_estimate_crosses_month_end: fixed-date express order (2026-01-31) must return 200 with estimated_delivery 2026-02-02"
    }
  ],
  "tests": {
    "ran": true,
    "command": "uv run --frozen pytest -q",
    "passed": true,
    "summary": "6 passed. The new regression test uses a fixed date. I did not run it against the unpatched code; the old expression raises ValueError for 31+2, so it should fail there."
  },
  "verification_requests": [
    "/api/orders/express-1002"
  ],
  "escalation_reason": null,
  "final_message": "INC-20260930-125626-5af5: /api/orders/{order_id} returns 500 for express-1002.\nCause: order_detail used placed_at.replace(day=day+2), which overflows near month end (ValueError). It is a latent bug hit by the seed data, not a deploy regression.\nFix: use placed_at + timedelta(days=2), plus a date-independent regression test. Full suite passes (6 passed).\nVerdict: patch proposed, small local fix, confidence 0.97; replay GET /api/orders/express-1002 after deploy."
}